{
  "sourceCommit": "0000000000000000000000000000000000000000",
  "artifactSha256": "0000000000000000000000000000000000000000000000000000000000000000",
  "checks": [
    {
      "status": "unverified",
      "required": true,
      "id": "visual",
      "evidence": [],
      "kind": "manual",
      "artifactSha256": "0000000000000000000000000000000000000000000000000000000000000000"
    }
  ],
  "schemaVersion": 1
}
